{"all_phases_done": false, "artifact_count": 28, "artifacts": [{"byte_count": 54571, "line_count": 733, "path": "config/statlean_blueprint.json", "sha256": "91f5b6afd728e4330c15870669b710d039ae79f19f80636a03fca7a4e42e2735"}, {"byte_count": 123719, "line_count": 99, "path": "benchmarks/seeds.jsonl", "sha256": "4e8a8edbd0bb042ef27376833d6c272e5ba8fc47904bbd432ce484ae761a3b24"}, {"byte_count": 16255, "line_count": 99, "path": "artifacts/verification/benchmark-seed-reports.jsonl", "sha256": "5e8a76274d40aa37ca711c947fe4dc866e2016670deaf3f6ceb0fced9245ee5a"}, {"byte_count": 80434, "line_count": 99, "path": "artifacts/evaluation/benchmark-seed-attempts.jsonl", "sha256": "199cbb7d4e6a46189f5f3dbf25d4e4780cec577934c92070d6e92533d874a7c3"}, {"byte_count": 8899, "line_count": 1, "path": "artifacts/evaluation/benchmark-seed-summary.json", "sha256": "0944eb780a9a45cd1bca64c03170eafc2d64f2df5159a49fd87f41c3c7b29324"}, {"byte_count": 1702, "line_count": 1, "path": "artifacts/evaluation/heldout-baseline.json", "sha256": "79da40f478d4d5fd3fd3d2dafac488d1484cd11a917e09dd39b41b3f8d7a786a"}, {"byte_count": 5164, "line_count": 1, "path": "artifacts/evaluation/paper-quality-heldout.json", "sha256": "12525e95283f7f0cc1c549926099da076bd1c87565785d367d7551fed2d8e20f"}, {"byte_count": 2013, "line_count": 1, "path": "artifacts/evaluation/concrete-estimator-chain.json", "sha256": "d1ef90be98a54ea06eb0da704d0fdb45d9cc7d23afecda7f7e982c1f5fecbc71"}, {"byte_count": 3485, "line_count": 1, "path": "artifacts/evaluation/ablation-report.json", "sha256": "d4ce8e938d64bd268e22a773e92c585ecd30265dd5f73591c87c819156c34a49"}, {"byte_count": 4964, "line_count": 1, "path": "artifacts/evaluation/external-baseline-plan.json", "sha256": "aae22b28ccde89c1447fc74665f3f27139a4156afec133d699aa4bd9d6a52a55"}, {"byte_count": 5599, "line_count": 1, "path": "artifacts/evaluation/external-baseline-results.json", "sha256": "d958c78fe872024813e3adbcb4d595384ae7f5d00593114b0da2e90a35847599"}, {"byte_count": 21232, "line_count": 1, "path": "artifacts/evaluation/empirical-process-targets.json", "sha256": "16a83fd1948bcf0e3853f8d2e91bd0e8e1999aea08edc795aad63ab216b342c4"}, {"byte_count": 10367, "line_count": 1, "path": "artifacts/evaluation/empirical-process-external-slice.json", "sha256": "2b2cc78c0a6b4897f2617d9f57fbc7459cefbe2d7d4c8cf5c43f50f5b7ea7e32"}, {"byte_count": 16398, "line_count": 1, "path": "artifacts/research/vdvw-theorem-inventory.json", "sha256": "c40f8da33f1c6f8692ad75870dd10e9457af848174f68b1b6a06dac150beebdc"}, {"byte_count": 11053, "line_count": 1, "path": "artifacts/research/vdvw-bracketing-gc-statement-candidates.json", "sha256": "6b1b7fc5996b5c744bf838402e0ab69a384b6f39e6d843361baf6b8b9264e862"}, {"byte_count": 13582, "line_count": 1, "path": "artifacts/research/vdvw-vc-donsker-proof-obligations.json", "sha256": "c9791241db851afaf1da8a89f3cf68ca72b0b42de213d4b14c87115185ac9d09"}, {"byte_count": 24249, "line_count": 1, "path": "artifacts/research/vdvw-primitive-empirical-semantics.json", "sha256": "56d6d1b00eaa7f31f8a0240eec6faa906d0bcf3f4defc80f8c6cb6bd847be30f"}, {"byte_count": 314594, "line_count": 1, "path": "artifacts/training/manifest.json", "sha256": "92de4539ac2dc784fcefc7018fcc2dab649a15ae19505e18e7eabe5b83b4f3b1"}, {"byte_count": 67977, "line_count": 94, "path": "artifacts/training/dpo-negative-attempts.jsonl", "sha256": "29d42242b7edb011d214307b0c65bf615f6ef5763271146f12c79d10ce41e80a"}, {"byte_count": 36207, "line_count": 94, "path": "artifacts/training/dpo-negative-reports.jsonl", "sha256": "44a9b35ee1141b1baa72fb2f1e6a0a11796897383d07a59b6ed579e85b2f298c"}, {"byte_count": 200347, "line_count": 99, "path": "artifacts/training/grpo-process-tasks.jsonl", "sha256": "b18ffef8394833d94631bb8be1c7a9fe65b8cf5f1dbe772db740713f2cb96d81"}, {"byte_count": 7148, "line_count": 5, "path": "artifacts/curation/theorem-hole-ledger.jsonl", "sha256": "330c4533be863bbe1a9ea7cb06fcab4dcd5caa9896b6303846d6476cf007c919"}, {"byte_count": 9698, "line_count": 5, "path": "artifacts/curation/lemma-proposals.jsonl", "sha256": "99234f132f156a6c856b7fcdbb0991a47916d4ca516020355d9e987fe9a8d6a0"}, {"byte_count": 5429, "line_count": 1, "path": "artifacts/curation/theorem-hole-promotion-queue.json", "sha256": "4bcc254372e235a6c3b0b2c3cd4991f3ab3b3e272e3da772035a390fe1d26805"}, {"byte_count": 2683, "line_count": 5, "path": "artifacts/curation/lemma-proposal-gates.jsonl", "sha256": "18b0cf26082303081e23f1259eee9be179548e457d9a608096dd016ff28fcee9"}, {"byte_count": 4301, "line_count": 5, "path": "artifacts/curation/lemma-non-vacuity.jsonl", "sha256": "999b786e330f07911b8f63fb1b9584d30574568d0b67441cc583367afa42e8df"}, {"byte_count": 3670, "line_count": 5, "path": "artifacts/curation/lemma-proof-cost.jsonl", "sha256": "4ae5d42ef1ac42305fc2791be343e6d37496d5516531cf7f8808bfdff643f003"}, {"byte_count": 5625, "line_count": 118, "path": "docs/paper_draft.md", "sha256": "206fc2701a6e299998f7bd6d8a3cfea03793ceaeba68bf3fbafc8b1f43e2d1f0"}], "blueprint_id": "statleanagent-blueprint", "blueprint_title": "StatLeanAgent Progressive Build Blueprint", "current_milestone": {"id": "P12.M3", "name": "Endpoint SLLN to finite-bracketing theorem-hole seeds", "status": "in_progress"}, "current_phase": {"id": "P12", "name": "Primitive Empirical-Process Semantics", "status": "in_progress"}, "done_phase_count": 12, "guardrails": ["No promoted StatInference theorem may rely on forbidden proof shortcuts.", "Training artifacts are preparation data, not evidence of a trained model improvement.", "Ablation rows are system-component readiness ablations, not a model-performance claim.", "Statistical semantics and new theorem statements still require human review."], "notes": "P8.M4 reproducibility bundle: hash-pinned artifacts, executable validation commands, paper draft linkage, and explicit guardrails.", "paper_draft_path": "docs/paper_draft.md", "phase_count": 13, "report_id": "reproducibility::p8", "reproduction_order": ["Install Python development dependencies with pip install -e \".[dev]\".", "Run the validation_commands in order from this report.", "Compare artifact sha256 values against the artifacts table.", "Use docs/paper_draft.md as the paper narrative tied to these artifacts.", "Use config/statlean_blueprint.json as the executable progress contract."], "validation_commands": [{"command": "PYTHONPATH=src .venv/bin/python -m pytest", "name": "python_tests", "purpose": "Run the complete Python test suite."}, {"command": "PYTHON=.venv/bin/python bash scripts/smoke.sh", "name": "smoke", "purpose": "Run deterministic benchmark, premise-index, manifest, and blueprint smoke checks."}, {"command": "lake build", "name": "lean_build", "purpose": "Compile the Lean StatInference library and benchmark modules."}, {"command": "PYTHONPATH=src .venv/bin/python -m statlean_agent.cli blueprint-status --blueprint config/statlean_blueprint.json", "name": "blueprint_status", "purpose": "Confirm the executable build blueprint status."}, {"command": "rg -n \"\\b(sorry|admit|unsafe)\\b|^\\s*axiom\\b\" StatInference -g '*.lean'", "name": "forbidden_lean_shortcuts", "purpose": "Fail if promoted Lean sources contain forbidden proof shortcuts."}]}
